-------------------------------------------------------------------------------
Test set: TestSuite
-------------------------------------------------------------------------------
Tests run: 10, Failures: 2, Errors: 0, Skipped: 7, Time elapsed: 32.72 s <<< FAILURE! -- in TestSuite
tests.DreamDiaryTest.setup -- Time elapsed: 13.82 s <<< FAILURE!
org.openqa.selenium.TimeoutException: 
Expected condition failed: waiting for visibility of element located by By.cssSelector: table tbody tr (tried for 10 second(s) with 500 milliseconds interval)
Build info: version: '4.13.0', revision: 'ba948ece5b*'
System info: os.name: 'Windows 11', os.arch: 'amd64', os.version: '10.0', java.version: '25.0.1'
Driver info: org.openqa.selenium.chrome.ChromeDriver
Capabilities {acceptInsecureCerts: false, browserName: chrome, browserVersion: 142.0.7444.176, chrome: {chromedriverVersion: 142.0.7444.175 (302067f14a4..., userDataDir: C:\Users\sange\AppData\Loca...}, fedcm:accounts: true, goog:chromeOptions: {debuggerAddress: localhost:58646}, goog:processID: 17088, networkConnectionEnabled: false, pageLoadStrategy: normal, platformName: windows, proxy: Proxy(), se:cdp: ws://localhost:58646/devtoo..., se:cdpVersion: 142.0.7444.176, setWindowRect: true, strictFileInteractability: false, timeouts: {implicit: 0, pageLoad: 300000, script: 30000}, unhandledPromptBehavior: dismiss and notify, webauthn:extension:credBlob: true, webauthn:extension:largeBlob: true, webauthn:extension:minPinLength: true, webauthn:extension:prf: true, webauthn:virtualAuthenticators: true}
Session ID: 293cc5e2b6b4585094132c6febcdc103
	at org.openqa.selenium.support.ui.WebDriverWait.timeoutException(WebDriverWait.java:84)
	at org.openqa.selenium.support.ui.FluentWait.until(FluentWait.java:230)
	at pages.DreamDiaryPage.<init>(DreamDiaryPage.java:23)
	at tests.DreamDiaryTest.setup(DreamDiaryTest.java:25)
	at java.base/jdk.internal.reflect.DirectMethodHandleAccessor.invoke(DirectMethodHandleAccessor.java:104)
	at java.base/java.lang.reflect.Method.invoke(Method.java:565)
	at org.testng.internal.invokers.MethodInvocationHelper.invokeMethod(MethodInvocationHelper.java:139)
	at org.testng.internal.invokers.MethodInvocationHelper.invokeMethodConsideringTimeout(MethodInvocationHelper.java:69)
	at org.testng.internal.invokers.ConfigInvoker.invokeConfigurationMethod(ConfigInvoker.java:361)
	at org.testng.internal.invokers.ConfigInvoker.invokeConfigurations(ConfigInvoker.java:296)
	at org.testng.internal.invokers.TestMethodWorker.invokeBeforeClassMethods(TestMethodWorker.java:180)
	at org.testng.internal.invokers.TestMethodWorker.run(TestMethodWorker.java:122)
	at java.base/java.util.ArrayList.forEach(ArrayList.java:1604)
	at org.testng.TestRunner.privateRun(TestRunner.java:829)
	at org.testng.TestRunner.run(TestRunner.java:602)
	at org.testng.SuiteRunner.runTest(SuiteRunner.java:437)
	at org.testng.SuiteRunner.runSequentially(SuiteRunner.java:431)
	at org.testng.SuiteRunner.privateRun(SuiteRunner.java:391)
	at org.testng.SuiteRunner.run(SuiteRunner.java:330)
	at org.testng.SuiteRunnerWorker.runSuite(SuiteRunnerWorker.java:52)
	at org.testng.SuiteRunnerWorker.run(SuiteRunnerWorker.java:95)
	at org.testng.TestNG.runSuitesSequentially(TestNG.java:1256)
	at org.testng.TestNG.runSuitesLocally(TestNG.java:1176)
	at org.testng.TestNG.runSuites(TestNG.java:1099)
	at org.testng.TestNG.run(TestNG.java:1067)
	at org.apache.maven.surefire.testng.TestNGExecutor.run(TestNGExecutor.java:308)
	at org.apache.maven.surefire.testng.TestNGXmlTestSuite.execute(TestNGXmlTestSuite.java:71)
	at org.apache.maven.surefire.testng.TestNGProvider.invoke(TestNGProvider.java:113)
	at org.apache.maven.surefire.booter.ForkedBooter.runSuitesInProcess(ForkedBooter.java:385)
	at org.apache.maven.surefire.booter.ForkedBooter.execute(ForkedBooter.java:162)
	at org.apache.maven.surefire.booter.ForkedBooter.run(ForkedBooter.java:507)
	at org.apache.maven.surefire.booter.ForkedBooter.main(ForkedBooter.java:495)

tests.DreamSummaryTest.setup -- Time elapsed: 11.53 s <<< FAILURE!
org.openqa.selenium.TimeoutException: 
Expected condition failed: waiting for visibility of element located by By.id: good-count (tried for 10 second(s) with 500 milliseconds interval)
Build info: version: '4.13.0', revision: 'ba948ece5b*'
System info: os.name: 'Windows 11', os.arch: 'amd64', os.version: '10.0', java.version: '25.0.1'
Driver info: org.openqa.selenium.chrome.ChromeDriver
Capabilities {acceptInsecureCerts: false, browserName: chrome, browserVersion: 142.0.7444.176, chrome: {chromedriverVersion: 142.0.7444.175 (302067f14a4..., userDataDir: C:\Users\sange\AppData\Loca...}, fedcm:accounts: true, goog:chromeOptions: {debuggerAddress: localhost:51769}, goog:processID: 22416, networkConnectionEnabled: false, pageLoadStrategy: normal, platformName: windows, proxy: Proxy(), se:cdp: ws://localhost:51769/devtoo..., se:cdpVersion: 142.0.7444.176, setWindowRect: true, strictFileInteractability: false, timeouts: {implicit: 0, pageLoad: 300000, script: 30000}, unhandledPromptBehavior: dismiss and notify, webauthn:extension:credBlob: true, webauthn:extension:largeBlob: true, webauthn:extension:minPinLength: true, webauthn:extension:prf: true, webauthn:virtualAuthenticators: true}
Session ID: f86a860e34bffe5f96bea63a81c18e6a
	at org.openqa.selenium.support.ui.WebDriverWait.timeoutException(WebDriverWait.java:84)
	at org.openqa.selenium.support.ui.FluentWait.until(FluentWait.java:230)
	at pages.DreamSummaryPage.<init>(DreamSummaryPage.java:27)
	at tests.DreamSummaryTest.setup(DreamSummaryTest.java:25)
	at java.base/jdk.internal.reflect.DirectMethodHandleAccessor.invoke(DirectMethodHandleAccessor.java:104)
	at java.base/java.lang.reflect.Method.invoke(Method.java:565)
	at org.testng.internal.invokers.MethodInvocationHelper.invokeMethod(MethodInvocationHelper.java:139)
	at org.testng.internal.invokers.MethodInvocationHelper.invokeMethodConsideringTimeout(MethodInvocationHelper.java:69)
	at org.testng.internal.invokers.ConfigInvoker.invokeConfigurationMethod(ConfigInvoker.java:361)
	at org.testng.internal.invokers.ConfigInvoker.invokeConfigurations(ConfigInvoker.java:296)
	at org.testng.internal.invokers.TestMethodWorker.invokeBeforeClassMethods(TestMethodWorker.java:180)
	at org.testng.internal.invokers.TestMethodWorker.run(TestMethodWorker.java:122)
	at java.base/java.util.ArrayList.forEach(ArrayList.java:1604)
	at org.testng.TestRunner.privateRun(TestRunner.java:829)
	at org.testng.TestRunner.run(TestRunner.java:602)
	at org.testng.SuiteRunner.runTest(SuiteRunner.java:437)
	at org.testng.SuiteRunner.runSequentially(SuiteRunner.java:431)
	at org.testng.SuiteRunner.privateRun(SuiteRunner.java:391)
	at org.testng.SuiteRunner.run(SuiteRunner.java:330)
	at org.testng.SuiteRunnerWorker.runSuite(SuiteRunnerWorker.java:52)
	at org.testng.SuiteRunnerWorker.run(SuiteRunnerWorker.java:95)
	at org.testng.TestNG.runSuitesSequentially(TestNG.java:1256)
	at org.testng.TestNG.runSuitesLocally(TestNG.java:1176)
	at org.testng.TestNG.runSuites(TestNG.java:1099)
	at org.testng.TestNG.run(TestNG.java:1067)
	at org.apache.maven.surefire.testng.TestNGExecutor.run(TestNGExecutor.java:308)
	at org.apache.maven.surefire.testng.TestNGXmlTestSuite.execute(TestNGXmlTestSuite.java:71)
	at org.apache.maven.surefire.testng.TestNGProvider.invoke(TestNGProvider.java:113)
	at org.apache.maven.surefire.booter.ForkedBooter.runSuitesInProcess(ForkedBooter.java:385)
	at org.apache.maven.surefire.booter.ForkedBooter.execute(ForkedBooter.java:162)
	at org.apache.maven.surefire.booter.ForkedBooter.run(ForkedBooter.java:507)
	at org.apache.maven.surefire.booter.ForkedBooter.main(ForkedBooter.java:495)

